{
  "id": "rb-screen",
  "name": "Running Back Screen",
  "variant": "tackle11",
  "type": "pass",
  "formationId": "shotgun-tackle",
  "defenseFormationId": "base-34-tackle",
  "description": "A trick on the pass rush. The linemen let the rushers through on purpose while the quarterback drops way back. The running back slips out to the side, the quarterback tosses it over the rushers, and the linemen run out in front of him to block.",
  "why": "When the defense rushes hard, it runs itself right past the play. The running back catches the ball with three big blockers in front of him and lots of green grass.",
  "assignments": [
    { "playerId": "qb", "kind": "dropback", "path": [{ "x": 0, "y": -8 }, { "x": 1, "y": -9 }], "speed": 4.5 },
    { "playerId": "rb", "kind": "route", "path": [{ "x": 1, "y": -6 }, { "x": 5, "y": -4 }, { "x": 8, "y": -2 }, { "x": 10, "y": 4 }, { "x": 12, "y": 14 }], "speed": 6, "delay": 0.3 },
    { "playerId": "c", "kind": "block", "path": [{ "x": 0, "y": -1.5 }, { "x": 6, "y": 0 }, { "x": 9, "y": 3 }], "speed": 4 },
    { "playerId": "lg", "kind": "block", "path": [{ "x": -2, "y": -1.5 }, { "x": -2.5, "y": -2.5 }], "speed": 3 },
    { "playerId": "rg", "kind": "block", "path": [{ "x": 2, "y": -1.5 }, { "x": 8, "y": -1 }, { "x": 11, "y": 2 }], "speed": 4 },
    { "playerId": "lt", "kind": "block", "path": [{ "x": -4.5, "y": -2.5 }], "speed": 3 },
    { "playerId": "rt", "kind": "block", "path": [{ "x": 4.5, "y": -2 }, { "x": 10, "y": 0 }, { "x": 14, "y": 3 }], "speed": 4 },
    { "playerId": "te", "kind": "route", "path": [{ "x": 7, "y": 3 }, { "x": 9, "y": 8 }], "speed": 6 },
    { "playerId": "wr-x", "kind": "route", "path": [{ "x": -20, "y": 12 }], "speed": 7 },
    { "playerId": "wr-y", "kind": "block", "path": [{ "x": 12, "y": 4 }, { "x": 13, "y": 6 }], "speed": 6 },
    { "playerId": "wr-z", "kind": "route", "path": [{ "x": 20, "y": 12 }], "speed": 7 },
    { "playerId": "nt", "kind": "rush", "path": [{ "x": 0, "y": -3 }, { "x": 0, "y": -6 }], "speed": 3, "delay": 0.1 },
    { "playerId": "lde", "kind": "rush", "path": [{ "x": -5, "y": -3 }, { "x": -3, "y": -7 }], "speed": 3.5, "delay": 0.1 },
    { "playerId": "rde", "kind": "rush", "path": [{ "x": 4, "y": -3 }, { "x": 2, "y": -7 }], "speed": 3.5, "delay": 0.1 },
    { "playerId": "lolb", "kind": "rush", "path": [{ "x": -7, "y": -2 }, { "x": -5, "y": -6 }], "speed": 4, "delay": 0.1 },
    { "playerId": "rolb", "kind": "cover", "path": [{ "x": 7, "y": 3 }, { "x": 9, "y": 5 }], "speed": 4, "delay": 0.3 },
    { "playerId": "lilb", "kind": "cover", "path": [{ "x": -3, "y": 7 }], "speed": 5, "delay": 0.4 },
    { "playerId": "rilb", "kind": "pursue", "path": [{ "x": 3, "y": 6 }, { "x": 9, "y": 5 }], "speed": 5, "delay": 0.6 },
    { "playerId": "lcb", "kind": "cover", "path": [{ "x": -19, "y": 12 }], "speed": 6, "delay": 0.5 },
    { "playerId": "rcb", "kind": "cover", "path": [{ "x": 19, "y": 12 }], "speed": 6, "delay": 0.5 },
    { "playerId": "fs", "kind": "cover", "path": [{ "x": -2, "y": 17 }], "speed": 4, "delay": 0.6 },
    { "playerId": "ss", "kind": "pursue", "path": [{ "x": 8, "y": 10 }, { "x": 11, "y": 7 }], "speed": 5, "delay": 0.9 }
  ],
  "ball": { "start": "c", "events": [{ "t": 0, "to": "qb" }, { "t": 1.8, "to": "rb", "throw": true }] }
}
