{
  "id": "iso-lead",
  "name": "Iso (Lead Run)",
  "variant": "tackle11",
  "type": "run",
  "formationId": "i-form-tackle",
  "defenseFormationId": "base-43-tackle",
  "description": "A power run up the middle. The fullback goes first and blocks the middle linebacker. The running back takes the handoff and follows right behind the fullback through the hole.",
  "why": "Iso is short for isolate. The linemen block the linemen, so the middle linebacker is left alone, isolated, for the fullback. When the fullback wins that block, the running back has a clear lane.",
  "assignments": [
    { "playerId": "qb", "kind": "dropback", "path": [{ "x": -1, "y": -2.5 }], "speed": 4 },
    { "playerId": "rb", "kind": "carry", "path": [{ "x": 0, "y": -4 }, { "x": -1.5, "y": 0.5 }, { "x": -1.5, "y": 5 }, { "x": -1, "y": 14 }], "speed": 6.5 },
    { "playerId": "fb", "kind": "block", "path": [{ "x": -1, "y": 0.8 }, { "x": -1.5, "y": 3.5 }], "speed": 4.5 },
    { "playerId": "c", "kind": "block", "path": [{ "x": 0, "y": 0.6 }], "speed": 3 },
    { "playerId": "lg", "kind": "block", "path": [{ "x": -2, "y": 0.6 }], "speed": 3 },
    { "playerId": "rg", "kind": "block", "path": [{ "x": 2, "y": 0.6 }], "speed": 3 },
    { "playerId": "lt", "kind": "block", "path": [{ "x": -4.5, "y": 0.6 }], "speed": 3 },
    { "playerId": "rt", "kind": "block", "path": [{ "x": 4.5, "y": 0.6 }], "speed": 3 },
    { "playerId": "te", "kind": "block", "path": [{ "x": 6.5, "y": 0.6 }], "speed": 3 },
    { "playerId": "wr-x", "kind": "block", "path": [{ "x": -19, "y": 5 }], "speed": 5 },
    { "playerId": "wr-z", "kind": "block", "path": [{ "x": 18, "y": 5 }], "speed": 5 },
    { "playerId": "lde", "kind": "pursue", "path": [{ "x": -5, "y": 1.8 }], "speed": 2.5, "delay": 0.2 },
    { "playerId": "ldt", "kind": "pursue", "path": [{ "x": -2, "y": 1.8 }], "speed": 2.5, "delay": 0.2 },
    { "playerId": "rdt", "kind": "pursue", "path": [{ "x": 3, "y": 1.8 }], "speed": 2.5, "delay": 0.2 },
    { "playerId": "rde", "kind": "pursue", "path": [{ "x": 6.5, "y": 1.8 }], "speed": 2.5, "delay": 0.2 },
    { "playerId": "mike", "kind": "pursue", "path": [{ "x": -1.5, "y": 3.8 }], "speed": 4, "delay": 0.5 },
    { "playerId": "will", "kind": "pursue", "path": [{ "x": -3, "y": 3.5 }, { "x": -2, "y": 6 }], "speed": 5, "delay": 0.6 },
    { "playerId": "sam", "kind": "pursue", "path": [{ "x": 3, "y": 3.5 }, { "x": 0, "y": 7 }], "speed": 5, "delay": 0.6 },
    { "playerId": "lcb", "kind": "cover", "path": [{ "x": -19, "y": 6.5 }], "speed": 4, "delay": 0.5 },
    { "playerId": "rcb", "kind": "cover", "path": [{ "x": 19, "y": 6.5 }], "speed": 4, "delay": 0.5 },
    { "playerId": "fs", "kind": "pursue", "path": [{ "x": -2, "y": 12 }, { "x": -1.5, "y": 15 }], "speed": 4.5, "delay": 1.2 },
    { "playerId": "ss", "kind": "pursue", "path": [{ "x": 4, "y": 9 }, { "x": 0, "y": 14 }], "speed": 5, "delay": 1 }
  ],
  "ball": { "start": "c", "events": [{ "t": 0, "to": "qb" }, { "t": 0.9, "to": "rb" }] }
}
