{
  "id": "outside-zone-left",
  "name": "Outside Zone Left",
  "variant": "tackle11",
  "type": "run",
  "formationId": "shotgun-tackle",
  "defenseFormationId": "base-34-tackle",
  "description": "A stretch run to the left. The running back takes the handoff and runs wide toward the sideline while the whole line slides left. If a lane opens early, he cuts up. If not, he keeps going around the edge.",
  "why": "Sliding the whole line one way stretches the defense sideways. Defenders who chase too hard leave a cutback lane behind them. The runner has one read: get outside, or cut back.",
  "assignments": [
    { "playerId": "qb", "kind": "dropback", "path": [{ "x": -1, "y": -5.5 }], "speed": 3 },
    { "playerId": "rb", "kind": "carry", "path": [{ "x": -2, "y": -4 }, { "x": -7, "y": -1 }, { "x": -12, "y": 3 }, { "x": -15, "y": 12 }], "speed": 6.5 },
    { "playerId": "c", "kind": "block", "path": [{ "x": -1.5, "y": 0.6 }], "speed": 3.5 },
    { "playerId": "lg", "kind": "block", "path": [{ "x": -3.5, "y": 0.6 }], "speed": 3.5 },
    { "playerId": "rg", "kind": "block", "path": [{ "x": 0.5, "y": 0.6 }], "speed": 3.5 },
    { "playerId": "lt", "kind": "block", "path": [{ "x": -6, "y": 0.6 }, { "x": -7, "y": 2 }], "speed": 3.5 },
    { "playerId": "rt", "kind": "block", "path": [{ "x": 2.5, "y": 0.6 }], "speed": 3.5 },
    { "playerId": "te", "kind": "block", "path": [{ "x": 4.5, "y": 0.6 }], "speed": 3.5 },
    { "playerId": "wr-x", "kind": "block", "path": [{ "x": -19, "y": 5 }], "speed": 5 },
    { "playerId": "wr-y", "kind": "block", "path": [{ "x": 10, "y": 3 }], "speed": 5 },
    { "playerId": "wr-z", "kind": "block", "path": [{ "x": 19, "y": 5 }], "speed": 5 },
    { "playerId": "nt", "kind": "pursue", "path": [{ "x": -1, "y": 1.8 }], "speed": 2.5, "delay": 0.2 },
    { "playerId": "lde", "kind": "pursue", "path": [{ "x": -5, "y": 1.8 }, { "x": -8, "y": 3 }], "speed": 3, "delay": 0.2 },
    { "playerId": "rde", "kind": "pursue", "path": [{ "x": 4, "y": 1.8 }], "speed": 2.5, "delay": 0.2 },
    { "playerId": "lolb", "kind": "pursue", "path": [{ "x": -8, "y": 1.5 }, { "x": -11, "y": 3 }], "speed": 4, "delay": 0.3 },
    { "playerId": "rolb", "kind": "pursue", "path": [{ "x": 5, "y": 2.5 }], "speed": 4, "delay": 0.3 },
    { "playerId": "lilb", "kind": "pursue", "path": [{ "x": -5, "y": 4 }, { "x": -10, "y": 5 }], "speed": 5, "delay": 0.5 },
    { "playerId": "rilb", "kind": "pursue", "path": [{ "x": -2, "y": 4 }, { "x": -6, "y": 7 }], "speed": 5, "delay": 0.6 },
    { "playerId": "lcb", "kind": "cover", "path": [{ "x": -19, "y": 6.5 }], "speed": 4, "delay": 0.5 },
    { "playerId": "rcb", "kind": "cover", "path": [{ "x": 19, "y": 6.5 }], "speed": 4, "delay": 0.5 },
    { "playerId": "fs", "kind": "pursue", "path": [{ "x": -8, "y": 13 }, { "x": -13, "y": 14 }], "speed": 5, "delay": 1 },
    { "playerId": "ss", "kind": "pursue", "path": [{ "x": 6, "y": 9 }, { "x": -2, "y": 12 }], "speed": 5, "delay": 1 }
  ],
  "ball": { "start": "c", "events": [{ "t": 0, "to": "qb" }, { "t": 0.6, "to": "rb" }] }
}
