{
  "id": "inside-zone-right",
  "name": "Inside Zone Right",
  "variant": "tackle11",
  "type": "run",
  "formationId": "singleback-tackle",
  "defenseFormationId": "base-43-tackle",
  "description": "The quarterback hands the ball to the running back, who runs toward the right side of the line. The blockers all step right together and push the defense that way. The runner looks for a gap and cuts through it.",
  "why": "When every blocker moves the same direction, the defense gets pushed sideways and small gaps open up. The running back does not pick a hole before the snap. He reads the blocks and cuts wherever the gap appears.",
  "assignments": [
    { "playerId": "qb", "kind": "dropback", "path": [{ "x": -1, "y": -3 }, { "x": -1.5, "y": -3 }], "speed": 4 },
    { "playerId": "rb", "kind": "carry", "path": [{ "x": 1.5, "y": -3.5 }, { "x": 2.5, "y": 0.5 }, { "x": 3.5, "y": 6 }, { "x": 5, "y": 16 }], "speed": 6.5 },
    { "playerId": "c", "kind": "block", "path": [{ "x": 1, "y": 0.6 }], "speed": 3 },
    { "playerId": "lg", "kind": "block", "path": [{ "x": -0.5, "y": 0.6 }], "speed": 3 },
    { "playerId": "rg", "kind": "block", "path": [{ "x": 2.5, "y": 0.6 }], "speed": 3 },
    { "playerId": "lt", "kind": "block", "path": [{ "x": -2, "y": 0.6 }, { "x": -2.5, "y": 2.5 }], "speed": 3 },
    { "playerId": "rt", "kind": "block", "path": [{ "x": 4, "y": 0.6 }], "speed": 3 },
    { "playerId": "te", "kind": "block", "path": [{ "x": 5.5, "y": 0.6 }], "speed": 3 },
    { "playerId": "wr-x", "kind": "block", "path": [{ "x": -19, "y": 5 }], "speed": 5 },
    { "playerId": "wr-z", "kind": "block", "path": [{ "x": 19, "y": 5 }], "speed": 5 },
    { "playerId": "wr-y", "kind": "block", "path": [{ "x": -8, "y": 8 }], "speed": 5 },
    { "playerId": "lde", "kind": "pursue", "path": [{ "x": -3.5, "y": 1.8 }, { "x": -2.5, "y": 3 }], "speed": 3, "delay": 0.2 },
    { "playerId": "ldt", "kind": "pursue", "path": [{ "x": -0.5, "y": 1.8 }], "speed": 2.5, "delay": 0.2 },
    { "playerId": "rdt", "kind": "pursue", "path": [{ "x": 3, "y": 1.8 }], "speed": 2.5, "delay": 0.2 },
    { "playerId": "rde", "kind": "pursue", "path": [{ "x": 6, "y": 1.8 }], "speed": 2.5, "delay": 0.2 },
    { "playerId": "will", "kind": "pursue", "path": [{ "x": -1, "y": 3.5 }, { "x": 3.5, "y": 5 }], "speed": 5, "delay": 0.8 },
    { "playerId": "mike", "kind": "pursue", "path": [{ "x": 3, "y": 3.5 }, { "x": 4.5, "y": 8 }], "speed": 5, "delay": 0.6 },
    { "playerId": "sam", "kind": "pursue", "path": [{ "x": 6, "y": 3 }, { "x": 6, "y": 6 }], "speed": 5, "delay": 0.6 },
    { "playerId": "lcb", "kind": "cover", "path": [{ "x": -19, "y": 6.5 }], "speed": 4, "delay": 0.5 },
    { "playerId": "rcb", "kind": "cover", "path": [{ "x": 19, "y": 6.5 }], "speed": 4, "delay": 0.5 },
    { "playerId": "fs", "kind": "pursue", "path": [{ "x": 3, "y": 13 }, { "x": 6, "y": 14 }], "speed": 4, "delay": 1.2 },
    { "playerId": "ss", "kind": "pursue", "path": [{ "x": 8, "y": 9 }, { "x": 6.5, "y": 15 }], "speed": 5, "delay": 1 }
  ],
  "ball": {
    "start": "c",
    "events": [
      { "t": 0, "to": "qb" },
      { "t": 0.7, "to": "rb" }
    ]
  }
}
